text,target,label
jokowi perintahkan usut tuntas pelaku bom kampung melayu sampai keakar $URL$ $URL$,bom kampung melayu,neutral
"/ soal bom kampung melayu , mui: tindakan terorisme hukum haram $URL$",bom kampung melayu,neutral
mengapa bc sudah memberitakan bom kampung melayu sehari yang lalu? $URL$,bom kampung melayu,neutral
"jpn: pengakuan istri pelaku bom kampung melayu , ternyata $URL$ $MENTION$ $MENTION$ $URL$",bom kampung melayu,neutral
pagar nusa nu bantu polisi kawal keamanan pasca bom kampung melayu $URL$ $URL$,bom kampung melayu,neutral
"jpn: pengakuan istri pelaku bom kampung melayu , ternyata: $URL$ , bandung - polisi $URL$ $MENTION$ $URL$",bom kampung melayu,neutral
[bp] pagar nusa nu bantu polisi kawal keamanan pasca bom kampung melayu $URL$,bom kampung melayu,neutral
jkt48 tetap gelar konser terakhir ve pasca-ledakan bom kampung melayu -. $URL$,bom kampung melayu,neutral
$MENTION$ - bom kampung melayu - malaysia duga ada kaitan dengan teroris wandy jedi,bom kampung melayu,neutral
satu polisi korban bom kampung melayu dimakamkan di klaten: $URL$ via $MENTION$,bom kampung melayu,neutral
media asing ungkap siapa dalang teroris bom kampung melayu - $URL$ $URL$,bom kampung melayu,neutral
legislator pdip tak mau berspekulasi apakah bom kampung melayu terkait manchester dan filipina: bom bunuh diri yang $URL$ $URL$,bom kampung melayu,neutral
jokowi-jk datangi tkp bom kampung melayu $URL$,bom kampung melayu,neutral
$MENTION$ ketua dpd minta aparat usut tuntas aksi bom kampung melayu $URL$ $URL$,bom kampung melayu,neutral
rumah pelaku bom kampung melayu : petugas kepolisian melakukan pengeledahan rumah terduga teroris di kawasan padat $URL$,bom kampung melayu,neutral
update bom kampung melayu : kadiv humas mabes polri irjen pol setyo wasisto (kanan) didampingi kabagpenum divhumas $URL$,bom kampung melayu,neutral
pemakaman korban bom kampung melayu : suasana prosesi pemakaman polisi bripda taufan tsunami korban bom bunuh diri $URL$,bom kampung melayu,neutral
lho ada apa bc malah sudah memberitakan bom kampung melayu sehari yang lalu? $URL$ $MENTION$ $URL$,bom kampung melayu,neutral
"presiden joko widodo meninjau lokasi ledakan teror bom kampung melayu , jakarta $URL$",bom kampung melayu,neutral
"$MENTION$ fahri hamzah sebut pelaku teror bom kampung melayu gagal total, kenapa? $URL$ $MENTION$ $URL$",bom kampung melayu,negative
republikaonline: jokowi jenguk korban bom kampung melayu $URL$,bom kampung melayu,neutral
republikaonline: jokowi datangi tkp bom kampung melayu $URL$,bom kampung melayu,neutral
"^ soal bom kampung melayu , mui: tindakan terorisme hukum haram $URL$",bom kampung melayu,neutral
warga gelar aksi solidaritas untuk korban bom kampung melayu $URL$ $URL$,bom kampung melayu,neutral
"_ soal bom kampung melayu , mui: tindakan terorisme hukum haram $URL$",bom kampung melayu,neutral
"detikcom: bom kampung melayu , $MENTION$ dan $MENTION$ mengema $URL$ via detik_tv",bom kampung melayu,neutral
"-> soal bom kampung melayu , mui: tindakan terorisme hukum haram $URL$",bom kampung melayu,neutral
wiranto: bom kampung melayu hampir sama bom manchester arena $URL$ via $MENTION$ indonesia,bom kampung melayu,neutral
"{ soal bom kampung melayu , mui: tindakan terorisme hukum haram $URL$",bom kampung melayu,neutral
jokowi jenguk korban bom kampung melayu $URL$,bom kampung melayu,neutral
$MENTION$ - in picture: jokowi datangi tkp bom kampung melayu,bom kampung melayu,neutral
$MENTION$ - polisi korban bom kampung melayu dimakamkan di lampung,bom kampung melayu,neutral
"soal bom kampung melayu , mui: tindakan terorisme hukum haram $URL$",bom kampung melayu,neutral
jokowi datangi tkp bom kampung melayu $URL$,bom kampung melayu,neutral
"} soal bom kampung melayu , mui: tindakan terorisme hukum haram $URL$",bom kampung melayu,neutral
dp knpi kutuk teror bom kampung melayu $URL$,bom kampung melayu,neutral
"` soal bom kampung melayu , mui: tindakan terorisme hukum haram $URL$",bom kampung melayu,neutral
presiden jokowi sampaikan duka cita untuk korban bom kampung melayu - harian medan bisnis - membangun indonesia ya $URL$,bom kampung melayu,neutral
$MENTION$ tiga isu yang lenyap seketika usai bom kampung melayu meledak $URL$ $MENTION$ $URL$,bom kampung melayu,negative
"video/gambar2 korban bom kampung melayu yg seharus.a gk pantes/gk layak di share nih pda di share2 trs,nora bgt. $URL$",bom kampung melayu,negative
"| soal bom kampung melayu , mui: tindakan terorisme hukum haram $URL$",bom kampung melayu,neutral
"} soal bom kampung melayu , mui: tindakan terorisme hukum haram $URL$",bom kampung melayu,neutral
"jenguk korban bom kampung melayu , presiden jokowi: kita harus bersatu melawan $URL$ $URL$",bom kampung melayu,neutral
"/ soal bom kampung melayu , mui: tindakan terorisme hukum haram $URL$",bom kampung melayu,neutral
"$MENTION$ kecam bom kampung melayu , ketua gnpf-mui: membunuh 1 nyawa sama dengan membunuh. $URL$",bom kampung melayu,negative
"$MENTION$ kecam bom kampung melayu , ketua gnpf-mui: membunuh 1 nyawa sama dengan membunuh semua manusia. $URL$",bom kampung melayu,negative
"$MENTION$ kecam bom kampung melayu , ketua gnpf-mui: membunuh 1 nyawa sama dengan membunuh $URL$ $MENTION$ $URL$",bom kampung melayu,negative
"kecam bom kampung melayu , ketua gnpf-mui: membunuh 1 nyawa sama dengan membunuh semua manusia $URL$ $URL$",bom kampung melayu,neutral
"$MENTION$ kecam bom kampung melayu , ketua gnpf-mui: membunuh 1 nyawa sama dengan $URL$ $MENTION$ $URL$",bom kampung melayu,negative
"$MENTION$ kecam bom kampung melayu , ketua gnpf-mui: membunuh 1 nyawa sama dengan membunuh $URL$ $MENTION$ $URL$",bom kampung melayu,negative
"fzhoupinky: detikcom: bom kampung melayu , $MENTION$ dan $MENTION$ mengema $URL$ via detik_tv",bom kampung melayu,neutral
$MENTION$ :mengapa bc sudah memberitakan bom kampung melayu sehari yang lalu? $URL$ . $URL$,bom kampung melayu,neutral
jokowi dan kala jenguk korban teror bom kampung melayu $URL$ $MENTION$,bom kampung melayu,neutral
lpsk kunjungi korban bom kampung melayu di rs polri $URL$,bom kampung melayu,neutral
", soal bom kampung melayu , mui: tindakan terorisme hukum haram $URL$",bom kampung melayu,neutral
berikut nama para pelaku dan korban bom kampung melayu $URL$ $URL$,bom kampung melayu,neutral
polisi nt perketat pengamanan pasca terjadi bom kampung melayu $URL$ $URL$,bom kampung melayu,neutral
$MENTION$ | polisi korban bom kampung melayu diberikan penghargan $URL$ $MENTION$ | $MENTION$ $URL$,bom kampung melayu,neutral
polisi korban bom kampung melayu diberikan penghargan $URL$ $URL$,bom kampung melayu,neutral
"$MENTION$ bom kampung melayu , $MENTION$ dan $MENTION$ mengema $URL$ via detik_tv",bom kampung melayu,neutral
"$MENTION$ kecam bom kampung melayu , ketua gnpf-mui: membunuh 1 nyawa sama dengan $URL$ $MENTION$ $URL$",bom kampung melayu,negative
usut tuntas bom kampung melayu warga al merasa resah dan was was,bom kampung melayu,negative
tujuan bom kampung melayu dinilai ingin indonesia terus gaduh $URL$ $URL$,bom kampung melayu,neutral
"melepas bripda anumerta imam, korban bom kampung melayu : $URL$ melalui $MENTION$",bom kampung melayu,neutral
": bom kampung melayu , $MENTION$ dan $MENTION$ mengema $URL$ via detik_tv",bom kampung melayu,neutral
") soal bom kampung melayu , mui: tindakan terorisme hukum haram $URL$",bom kampung melayu,neutral
duh keceplosan! polisi sebut pelaku bom kampung melayu gugur! $URL$,bom kampung melayu,neutral
"> soal bom kampung melayu , mui: tindakan terorisme hukum haram $URL$",bom kampung melayu,neutral
teror bom kampung melayu tak bikin investorpanik $URL$ $URL$,bom kampung melayu,neutral
terduga pelaku bom kampung melayu tak terlalu dikenal tetanga $URL$ $URL$,bom kampung melayu,neutral
$MENTION$ polisi korban bom kampung melayu dimakamkan di lampung $URL$,bom kampung melayu,neutral
knpi sesalkan insiden bom kampung melayu $URL$ $URL$,bom kampung melayu,neutral
"[ soal bom kampung melayu , mui: tindakan terorisme hukum haram $URL$",bom kampung melayu,neutral
eksekutor bom kampung melayu berprofesi penjual obat herbal dan sangat tertutup $URL$,bom kampung melayu,neutral
presiden junjungi tkp bom kampung melayu : $URL$ melalui $MENTION$,bom kampung melayu,neutral
"pasca bom kampung melayu , sejumlah gereja dijaga ketat aparat polisi $URL$",bom kampung melayu,neutral
"rt detikcom "" bom kampung melayu , $MENTION$ dan $MENTION$ mengema $URL$ via detik_tv """,bom kampung melayu,neutral
kaget wiryawan ktp- dikaitkan dengan bom kampung melayu $URL$,bom kampung melayu,neutral
"pasca bom kampung melayu , kapolda sumut perintahkan patroli skala besar $URL$ $URL$",bom kampung melayu,neutral
tribun: eksekutor bom kampung melayu berprofesi penjual obat herbal dan sangat tertutup $URL$ $MENTION$ $MENTION$,bom kampung melayu,neutral
istri terduga pelaku bom kampung melayu diperiksa $URL$ $URL$,bom kampung melayu,neutral
"bripda ridho setiawan, korban bom kampung melayu dikebumikan di lampung $URL$",bom kampung melayu,neutral
"pengakuan istri pelaku bom kampung melayu , ternyata $URL$ $URL$",bom kampung melayu,neutral
"didampingi jk, jokowi jenguk korban bom kampung melayu di rs polri $URL$",bom kampung melayu,neutral
"pasca bom kampung melayu , amerika minta warga tinjau kembali rencana kunjungan ke indonesia $URL$",bom kampung melayu,neutral
"( soal bom kampung melayu , mui: tindakan terorisme hukum haram $URL$",bom kampung melayu,neutral
$MENTION$ jatim tingkatkan pengamanan pasca bom kampung melayu $URL$,bom kampung melayu,neutral
"tribun: eksekutor bom kampung melayu berprofesi penjual obat herbal dan sangat tertutup: selama ini, ins $URL$ $MENTION$",bom kampung melayu,neutral
australia juga keluarkan travel advice terkait bom kampung melayu - detikcom $URL$ $MENTION$,bom kampung melayu,neutral
cara kelola cemas akibat trauma bom kampung melayu $URL$ $MENTION$,bom kampung melayu,neutral
"buntut tuduh umat islam pelaku bom kampung melayu , boni hargens disemprot tni $URL$ $MENTION$ $URL$",bom kampung melayu,neutral
"hehehe.struk pembelian panci jadi barang bukti pelaku bom kampung melayu , begini komentar netizen $URL$ $MENTION$ $URL$",bom kampung melayu,neutral
salah satu korban selamat dr bom kampung melayu . sakti juga nih cewe.baju doangan yg robek. $URL$,bom kampung melayu,neutral
hoax pelaku bom kampung melayu mantan polisi dan kata rekayasa $URL$ $URL$,bom kampung melayu,neutral
"datangi lokasi ledakan bom kampung melayu , relawan jokowi tabur bunga $URL$ $MENTION$ $MENTION$ $URL$",bom kampung melayu,neutral
wali kota semarang ajak ribuan pengunjung dugderan doakan korban bom kampung melayu $URL$ $MENTION$ $URL$,bom kampung melayu,neutral
$MENTION$ warga gelar aksi solidaritas untuk korban bom kampung melayu $URL$ via $MENTION$ $URL$,bom kampung melayu,neutral
nu kutuk aksi bom kampung melayu $URL$ $MENTION$,bom kampung melayu,neutral
"'= soal bom kampung melayu , mui: tindakan terorisme hukum haram $URL$",bom kampung melayu,neutral
kesaksian pacar polisi korban bom kampung melayu $URL$,bom kampung melayu,neutral
"2 hari berlalu, blm ada pihak yg mengaku bertangung jwb terkait bom kampung melayu . lalu ? apa?dan siapa mereka ? $MENTION$",bom kampung melayu,negative
tadi sore di jalan raya solo-klaten lihat iring2in jenazah polisi korban bom kampung melayu . seketika sedih. $sad$ semoga keluarga tabah.,bom kampung melayu,negative
"abdul kharis : pelaku bom kampung melayu , biadab ! $URL$",bom kampung melayu,neutral
kronologi 2 ledakan bom kampung melayu $URL$ $URL$,bom kampung melayu,neutral
richard kutuk teror bom kampung melayu $URL$,bom kampung melayu,neutral
ada korelasi antara bom kampung melayu dengan darurat militer di filipina $URL$ $URL$,bom kampung melayu,neutral
ini kata jokowi soal serangan bom kampung melayu $URL$ via $MENTION$ $URL$,bom kampung melayu,neutral
polisi korban bom kampung melayu diberikan penghargan - warta ekonomi $URL$,bom kampung melayu,neutral
$MENTION$ warga gelar aksi solidaritas untuk korban bom kampung melayu $URL$ $URL$,bom kampung melayu,neutral
presiden dan wapres datangi lokasi bom kampung melayu : $URL$ via $MENTION$,bom kampung melayu,neutral
foto jokowi-jk di lokasi bom kampung melayu $URL$ $URL$,bom kampung melayu,neutral
polda jatim tingkatkan pengamanan pasca bom kampung melayu - $URL$ $URL$,bom kampung melayu,neutral
"pengakuan istri pelaku bom kampung melayu , ternyata $MENTION$ $URL$",bom kampung melayu,neutral
"$MENTION$ bom kampung melayu , mui: tindakan terorisme hukum haram $URL$",bom kampung melayu,neutral
")> soal bom kampung melayu , mui: tindakan terorisme hukum haram $URL$",bom kampung melayu,neutral
republikaonline: polisi korban bom kampung melayu dimakamkan di lampung $URL$,bom kampung melayu,neutral
"[ soal bom kampung melayu , mui: tindakan terorisme hukum haram $URL$",bom kampung melayu,neutral
wiranto: aksi bom kampung melayu pu kesaman dengan manchester $URL$ $URL$,bom kampung melayu,neutral
(menjawab) mereka yang bilang bom kampung melayu rekayasa $URL$,bom kampung melayu,neutral
$MENTION$ $MENTION$ keluarga kenali jasad terduga pelaku bom kampung melayu . $URL$,bom kampung melayu,neutral
"$MENTION$ $MENTION$ "" foto pelaku bom kampung melayu "" is trending today on gogle indonesia (10+ se $URL$",bom kampung melayu,neutral
benarkah karena beda zona waktu? media ini beritakan bom kampung melayu sehari sebelum $URL$,bom kampung melayu,neutral
jokowi-jk jenguk korban bom kampung melayu di rs polri. $URL$ lewat $MENTION$,bom kampung melayu,neutral
"rt metro_tv "" warga gelar aksi solidaritas untuk korban bom kampung melayu $URL$ $URL$ """,bom kampung melayu,neutral
$MENTION$ - polda jatim tingkatkan pengamanan pasca bom kampung melayu,bom kampung melayu,neutral
$MENTION$ - wiranto: aksi bom kampung melayu pu kesaman dengan manchester,bom kampung melayu,neutral
presiden jokowi dan jusuf kala tinjau lokasi bom kampung melayu : $URL$ via $MENTION$,bom kampung melayu,neutral
mereka yg radikal mengatakan bom kampung melayu rekaya antarkan mereka radikal itu kerumah sakit jiwa. $URL$,bom kampung melayu,neutral
presiden dan wapres ke lokasi bom kampung melayu : $URL$ via $MENTION$,bom kampung melayu,neutral
detikcom: polda jatim tingkatkan pengamanan pasca bom kampung melayu $URL$ $URL$,bom kampung melayu,neutral
"( soal bom kampung melayu , mui: tindakan terorisme hukum haram $URL$",bom kampung melayu,neutral
"> soal bom kampung melayu , mui: tindakan terorisme hukum haram $URL$",bom kampung melayu,neutral
"jpn: kesaksian tetanga tentang sosok ins, pelaku bom kampung melayu : $URL$ , bandung $URL$ $MENTION$ $URL$",bom kampung melayu,neutral
"jpn: kesaksian tetanga tentang sosok ins, pelaku bom kampung melayu $URL$ $MENTION$ $MENTION$ $URL$",bom kampung melayu,neutral
bom kampung melayu - inilah nama pelaku bom kampung melayu $URL$ $URL$,bom kampung melayu,neutral
ini 7 pernyatan sikap pbnu terkait bom kampung melayu $URL$ lewat $MENTION$,bom kampung melayu,neutral
$MENTION$ keluarga kenali jasad terduga pelaku bom kampung melayu . $URL$,bom kampung melayu,neutral
"$MENTION$ "" foto pelaku bom kampung melayu "" is trending today on gogle indonesia (10+ searches) $URL$",bom kampung melayu,neutral
polisi masih dalami identitas pelaku bom kampung melayu $URL$,bom kampung melayu,neutral
facebok aktifkan safety check terkait bom kampung melayu $URL$,bom kampung melayu,neutral
"< soal bom kampung melayu , mui: tindakan terorisme hukum haram $URL$",bom kampung melayu,neutral
pernyatan resmi dp kai tentang bom kampung melayu & situasi keamanan indonesia | baca selengkap : $URL$,bom kampung melayu,neutral
jokowi-jk tinjau tkp bom kampung melayu $URL$ $MENTION$ $MENTION$,bom kampung melayu,neutral
cek yuk -> polda jatim tingkatkan pengamanan pasca bom kampung melayu $URL$,bom kampung melayu,neutral
keluarga kenali jasad terduga pelaku bom kampung melayu . $URL$,bom kampung melayu,neutral
""" foto pelaku bom kampung melayu "" is trending today on gogle indonesia (10+ searches) $URL$",bom kampung melayu,neutral
bom kampung melayu ada kaitan dengan ledakan di manchester? - warta ekonomi $URL$,bom kampung melayu,neutral
pb pmi minta polri usut teror bom kampung melayu $URL$ lewat $MENTION$,bom kampung melayu,neutral
metro_tv: warga gelar aksi solidaritas untuk korban bom kampung melayu $URL$ $URL$,bom kampung melayu,neutral
warga menyanyikan lagu gugur bunga di lokasi bom kampung melayu . $URL$,bom kampung melayu,neutral
"] soal bom kampung melayu , mui: tindakan terorisme hukum haram $URL$",bom kampung melayu,neutral
masih ada bercak darah di lokasi bom kampung melayu $URL$,bom kampung melayu,neutral
ada empat karangan bunga di lokasi bom kampung melayu $URL$,bom kampung melayu,neutral
liputan6dotcom: doa anies untuk korban bom kampung melayu $URL$ $URL$,bom kampung melayu,neutral
liputan6dotcom: pemprov dki tangung biaya pengobatan korban bom kampung melayu $URL$ $URL$,bom kampung melayu,neutral
terduga pelaku bom kampung melayu beli panci di padalarang $URL$,bom kampung melayu,neutral
ditemukan struk pembelian panci di celana pelaku bom kampung melayu $URL$,bom kampung melayu,neutral
polisi periksa istri terduga pelaku bom kampung melayu $URL$,bom kampung melayu,neutral
begini kronologi bom kampung melayu versi polisi $URL$,bom kampung melayu,neutral
$MENTION$ cerita gelandang persepam mu yang terdampak bom kampung melayu $URL$ $URL$,bom kampung melayu,neutral
hits benarkah karena beda zona waktu? media ini beritakan bom kampung melayu sehari sebelum $URL$,bom kampung melayu,neutral
$MENTION$ jokowi: kejar sampai ke akar otak bom kampung melayu $URL$ $MENTION$ $URL$,bom kampung melayu,negative
jokowi: kejar sampai ke akar otak bom kampung melayu $URL$ $MENTION$ $URL$,bom kampung melayu,neutral
$MENTION$ polda jatim tingkatkan pengamanan pasca bom kampung melayu $URL$ $URL$,bom kampung melayu,neutral
"kaskusberita: lewat surat, pemimpin singapura kecam bom kampung melayu $URL$ $MENTION$",bom kampung melayu,neutral
cek -> polda jatim tingkatkan pengamanan pasca bom kampung melayu $URL$,bom kampung melayu,neutral
pemerintah dingatkan penting hak korban bom kampung melayu $URL$ $MENTION$,bom kampung melayu,neutral
polisi duga aksi bom kampung melayu terkait jaringan jad $URL$,bom kampung melayu,neutral
republikaonline: tujuan bom kampung melayu dinilai ingin indonesia terus gaduh $URL$,bom kampung melayu,neutral
ini alasan tiga korban bom kampung melayu dipindahkan ke rs polri: $URL$ melalui $MENTION$,bom kampung melayu,neutral
serpihan bom kampung melayu mirip bom panci di bandung: $URL$ melalui $MENTION$,bom kampung melayu,neutral
polisi sebut dua pelaku bom kampung melayu berinisial as dan i: $URL$ melalui $MENTION$,bom kampung melayu,neutral
mahasiswi ini terkena ledakan bom kampung melayu sat pulang kuliah: $URL$ melalui $MENTION$,bom kampung melayu,neutral
petugas jaga ketat rumah terduga peledakan bom kampung melayu $URL$ $URL$,bom kampung melayu,neutral
: doa anies untuk korban bom kampung melayu $URL$ $URL$,bom kampung melayu,neutral
: pemprov dki tangung biaya pengobatan korban bom kampung melayu $URL$ $URL$,bom kampung melayu,neutral
firasat keluarga briptu ridho korban tewas bom kampung melayu $URL$ $URL$,bom kampung melayu,neutral
cuitan boni hargens soal bom kampung melayu langsung disemprot puspen tni $URL$,bom kampung melayu,neutral
ini kicauan para radikalis sebelum bom kampung melayu terjadi . jgn anda bungkam disini ya $URL$,bom kampung melayu,negative
chirpified: benarkah karena beda zona waktu? media ini beritakan bom kampung melayu sehari sebelum $URL$,bom kampung melayu,neutral
luar biasa! ha butuh 5 menit bagi detikcom untuk menerbitkan berita bom kampung melayu $URL$ $MENTION$ $URL$,bom kampung melayu,neutral
polda jatim tingkatkan pengamanan pasca bom kampung melayu,bom kampung melayu,neutral
komisi i dpr apresiasi kepolisian atas pengungkapan pelaku bom kampung melayu . $URL$,bom kampung melayu,neutral
djarot: ledakan bom kampung melayu tidak berkaitan dengan pawai obor $URL$,bom kampung melayu,neutral
doa anies untuk korban bom kampung melayu $URL$ $URL$,bom kampung melayu,neutral
presiden dan wakil presiden jenguk korban bom kampung melayu $URL$ $URL$,bom kampung melayu,neutral
pemprov dki tangung biaya pengobatan korban bom kampung melayu $URL$ $URL$,bom kampung melayu,neutral
: polda jatim tingkatkan pengamanan pasca bom kampung melayu $URL$ $URL$,bom kampung melayu,neutral
metro_tv: petugas jaga ketat rumah terduga peledakan bom kampung melayu $URL$ $URL$,bom kampung melayu,neutral
&8206;sosok imam gilang adinata polisi korban teror bom kampung melayu di mata keluarga $URL$ $URL$,bom kampung melayu,neutral
presiden jokowi jenguk korban ledakan bom kampung melayu di rs polri kramatjati $URL$,bom kampung melayu,neutral
josua manurung- polda jatim tingkatkan pengamanan pasca bom kampung melayu $URL$ $MENTION$,bom kampung melayu,neutral
aksi lilin untuk korban bom kampung melayu $URL$,bom kampung melayu,neutral
inilah nama angota polisi yang meningal bom kampung melayu $URL$ $MENTION$ $URL$,bom kampung melayu,neutral
: firasat keluarga briptu ridho korban tewas bom kampung melayu $URL$ $URL$,bom kampung melayu,neutral
foto: bom kampung melayu $URL$ $URL$,bom kampung melayu,neutral
liputan6dotcom: firasat keluarga briptu ridho korban tewas bom kampung melayu $URL$ $URL$,bom kampung melayu,neutral
"ahmad sukri, terduga pelaku bom kampung melayu yang sempat tingal di garut selama 3 bulan. $URL$",bom kampung melayu,neutral
ada perintah khusus presiden jokowi ke wiranto pasca bom kampung melayu $URL$,bom kampung melayu,neutral
detik: polda jatim tingkatkan pengamanan pasca bom kampung melayu : pasca kejadian bom di kampung $URL$ $MENTION$ $URL$,bom kampung melayu,neutral
"kesaksian tetanga tentang sosok ins, pelaku bom kampung melayu $URL$",bom kampung melayu,neutral
detik: polda jatim tingkatkan pengamanan pasca bom kampung melayu $URL$ $MENTION$ $MENTION$ $URL$,bom kampung melayu,neutral
1 polda jatim tingkatkan pengamanan pasca bom kampung melayu $URL$,bom kampung melayu,neutral
"$MENTION$ ahmad sukri, terduga pelaku bom kampung melayu yang sempat tingal di garut selama 3 bulan $MENTION$ $MENTION$",bom kampung melayu,neutral
$MENTION$ polda jatim tingkatkan pengamanan pasca bom kampung melayu $URL$,bom kampung melayu,neutral
[ breaking news] inilah detik detik terjadi bom kampung melayu : $URL$ melalui $MENTION$,bom kampung melayu,neutral
polisi olah tkp ledakan bom kampung melayu $URL$,bom kampung melayu,neutral
"kesaksian tetanga tentang sosok ins, pelaku bom kampung melayu $MENTION$ $URL$",bom kampung melayu,neutral
momen kekompakan jokowi-jk: dari rs polri ke tkp bom kampung melayu $URL$ $MENTION$,bom kampung melayu,neutral
"tiba di jakarta, jokowi jenguk korban bom kampung melayu $URL$ $MENTION$",bom kampung melayu,neutral
""" $MENTION$ : pemerintah dingatkan penting hak korban bom kampung melayu $URL$ "" hak tangkap teroris duluin u yak?",bom kampung melayu,neutral
"liat ketegangan video amatir bom kampung melayu , serem bosque! $URL$",bom kampung melayu,neutral
"rt metro_tv "" petugas jaga ketat rumah terduga peledakan bom kampung melayu $URL$ $URL$ """,bom kampung melayu,neutral
"$MENTION$ - datangi lokasi bom kampung melayu , jokowi ingin ru antiterorisme segera diselesaikan",bom kampung melayu,neutral
polisi geledah rumah di bandung terkait teror bom kampung melayu - $URL$ $URL$ $URL$,bom kampung melayu,neutral
lpsk besuk korban bom kampung melayu : $URL$ melalui $MENTION$,bom kampung melayu,neutral
kaskusberita: &8206;sosok imam gilang adinata polisi korban teror bom kampung melayu di mata keluarga $URL$,bom kampung melayu,neutral
jenazah briptu ridho korban bom kampung melayu dimakamkan di lampung $URL$ $URL$,bom kampung melayu,neutral
"meningal sat bom kampung melayu ,briptu ridho setiawan naik pangkat $URL$ $URL$",bom kampung melayu,neutral
djarot jenguk korban bom kampung melayu di rs budi asih: $URL$ melalui $MENTION$,bom kampung melayu,neutral
komisi i dpr minta aparat ungkap aktor bom kampung melayu - warta ekonomi $URL$,bom kampung melayu,neutral
"soal bom kampung melayu , mui: tindakan terorisme hukum haram $URL$",bom kampung melayu,neutral
"soal bom kampung melayu , mui: tindakan terorisme hukum haram $URL$",bom kampung melayu,neutral
"soal bom kampung melayu , mui: tindakan terorisme hukum haram $URL$",bom kampung melayu,neutral
"soal bom kampung melayu , mui: tindakan terorisme hukum haram $URL$",bom kampung melayu,neutral
"soal bom kampung melayu , mui: tindakan terorisme hukum haram $URL$",bom kampung melayu,neutral
"soal bom kampung melayu , mui: tindakan terorisme hukum haram $URL$",bom kampung melayu,neutral
"soal bom kampung melayu , mui: tindakan terorisme hukum haram $URL$",bom kampung melayu,neutral
"soal bom kampung melayu , mui: tindakan terorisme hukum haram $URL$",bom kampung melayu,neutral
"soal bom kampung melayu , mui: tindakan terorisme hukum haram $URL$",bom kampung melayu,neutral
"soal bom kampung melayu , mui: tindakan terorisme hukum haram $URL$",bom kampung melayu,neutral
"<= * soal bom kampung melayu , mui: tindakan terorisme hukum haram $URL$",bom kampung melayu,neutral
"<- soal bom kampung melayu , mui: tindakan terorisme hukum haram $URL$",bom kampung melayu,neutral
"'=> soal bom kampung melayu , mui: tindakan terorisme hukum haram $URL$",bom kampung melayu,neutral
luar biasa! ha butuh 5 menit bagi detikcom untuk menerbitkan berita bom kampung melayu : ilustrasi bom yang $URL$ $URL$,bom kampung melayu,neutral
pengamat ini bongkar 8 tanda bom kampung melayu diduga kuat rekayasa $URL$,bom kampung melayu,neutral
"garis polisi dilepas, warga padati lokasi bom kampung melayu $URL$",bom kampung melayu,neutral
ketutup deh berita sama bom kampung melayu . $URL$,bom kampung melayu,neutral
inilah reaksi khofifah atas bom kampung melayu $URL$,bom kampung melayu,neutral
$MENTION$ - &8206;sosok imam gilang adinata polisi korban teror bom kampung melayu di mata keluarga,bom kampung melayu,neutral
