text,target,label
kata ahokers yg ikut demo 212 penganguran & miskin. ini jejeran mobil beli pakai apa? daun? $URL$,demo 212,negative
"ini bukti primitif masa demo 212 , tak sesuai ajaran islam $URL$ $URL$",demo 212,neutral
"ngakak sumpah cuma gara2 sari roti ngeluarin statement tak terlibat demo 212 , malah mau diboikot. alangkah lucu negeri ini wkwk",demo 212,neutral
klu demo 212 7 jt brapa bnyk lg jamah haji ya,demo 212,neutral
"sari roti itu ada di setiap peristiwa politik, pertama pas skype ama nazarudin (di belakang ada suara sari roti), kedua pas demo 212 :d",demo 212,neutral
yola si polwan cantik demo 212 diajak main film $URL$,demo 212,neutral
whops: foto a gym memungut sampah sat demo 212 menyitaperhatian $URL$ $URL$,demo 212,neutral
whops: foto a gym memungut sampah sat demo 212 menyita perhatian $URL$,demo 212,neutral
tp yg ga suka lgs komen bahwa dia tdk mendukung neutral ga mau dikaitin aksi demo 212 .,demo 212,negative
makna bendera hitam yang dibawa di demo 212 - berita islami masa kini trans tv hd: $URL$ via $MENTION$,demo 212,neutral
lah wajar. sari roti itu merk dagang. dan branding demo 212 lo itu bela islam. segmen konsumen mereka bukan cuma org islam. $URL$,demo 212,neutral
"fanmet monsta x di indonesia dibatalin karna alasan keamanan pasca demo 212 , d-4 loh '_ yang tawakal monbebe indonesia",demo 212,negative
"kasian peserta demo 212 yg beneran pengen ibadah&tahu ini buat agamanya.ternyata cuman dipake buat tameng itu preman dasteran,pepo,cukong",demo 212,negative
"biar muslim tapi kalo ga ikut demo 212 kata bkn islam, lucu ya kamu, iya kamu.",demo 212,negative
inikah skenario ' demo 212 ' yang dituding makar? $URL$,demo 212,neutral
"maksud biar nyata yg ga ikut demo 212 bukan islam ya $MENTION$ ,padahal umat islam ind.20 jt lebih,yg demo 7 jeti, sisa ngontrak? $URL$",demo 212,neutral
"asadiqulhaq: $MENTION$ ikut demo 212 , hizbut tahrir mojokerto usung isu khilafah $URL$ $MENTION$",demo 212,neutral
"$MENTION$ ikut demo 212 , hizbut tahrir mojokerto usung isu khilafah $URL$ $MENTION$",demo 212,neutral
"saya usul, yg ikut demo 212 dan 412 kemaren baca ini! biar waras. c $MENTION$ $URL$",demo 212,neutral
narasi $MENTION$ . demo 41 yg berujung ricuh. . demo 212 yg diwarnai kekerasan kpd wartawan. $URL$,demo 212,negative
"ful ! a gym sat demo 212 sentil kapolri tito karnavian "" damai "" $URL$ lewat $MENTION$",demo 212,neutral
yg kemaren ngatain demo 212 buih kmana ya.,demo 212,neutral
"poin 2 emang rada2 menyingung, seolah yg demo 212 anti nkri. sebaik itu ga pernah ada. syng sekali $MENTION$ $URL$",demo 212,neutral
rhoma irama: demo 212 bukti aksi persatuan indonesia -. $URL$,demo 212,positive
ditengah aksi demo 212 payung biru pak jokowi jadi trending fashion seperti jaket bomber: $URL$ via $MENTION$,demo 212,neutral
kaskusberita: rhoma irama: demo 212 bukti aksi persatuan indonesia $URL$ $MENTION$ $MENTION$,demo 212,positive
rhoma irama: demo 212 bukti aksi persatuan indonesia $URL$,demo 212,positive
okezonenews: rhoma irama: demo 212 bukti aksi persatuan indonesia $URL$ $URL$,demo 212,positive
kmrin demo 212 jdi nget ama kapak naga geni wiro sableng,demo 212,neutral
kapolri akui maklumat larangan demo 212 tak ampuh> $URL$,demo 212,negative
iya pak haji semoga aja.mungkin karena kok sedikit malu kemarin di singung kapolri waktu demo 212,demo 212,neutral
[ful] ceramah a gym sat demo 212 bikin sejuk dan menenangkan: $URL$ via $MENTION$,demo 212,neutral
"sdrku$MENTION$ disinilah $MENTION$ yg dikerjakan umat tergantung niatnya. peristiwa demo 212 itu ria "" sebab apalah seorang ahok """,demo 212,neutral
"kami sadar diri bang, asal bs hidup damai cukup,hrs mrk yg demo 212 banga justru ahok minoritas perhatia lebih ke mayoritas",demo 212,neutral
gk plintiran bapa. sy terima wa msg langsung dr pelaku (ormas) demo 212 sehari setelah 212,demo 212,neutral
claim bhw demo 212 lebih bnyk dibandingkan jamah haji 2016 itu yg plg lucu.itu org pernah lihat gimana ramai jamah haji gak sih?,demo 212,neutral
"besok, putri bung karno ini ajak masa demo 212 duduki dpr $URL$",demo 212,neutral
kapolri akui maklumat larangan demo 212 tak ampuh $URL$,demo 212,neutral
"ada bukti demo 212 mengotori monas pak? biasain kalo ngomong pake bukti, biar gk fitnah dan jadi sampah doang.",demo 212,positive
kita harus mengapresiasi keberhasilan polisi memastikan demo 212 berjalan dengan damai.,demo 212,neutral
"4,163 views rekaman percakapan dgn salim abdul qadir sebut agus di demo 212 beredar, . from $MENTION$ $URL$",demo 212,neutral
"$MENTION$ wawancara media indonesia pagi ini menyingung soal demo 212 di monas,kenapa setiap bicara slalu menyingung?",demo 212,neutral
yusril singung demo 212 dimonas $URL$,demo 212,neutral
provokator demo 212 tewas di. $URL$,demo 212,neutral
lihat dan jauh kan layar hp kalian. hasil demo 212,demo 212,neutral
pengamat politik demo 212 $URL$,demo 212,neutral
""" jangan kaitkan saya dengan demo 212 "" $URL$ lewat $MENTION$",demo 212,negative
"3,324 views rekaman percakapan dgn salim abdul qadir sebut agus di demo 212 beredar, . from $MENTION$ $URL$",demo 212,neutral
fpi lagi hitung hitungan keuntungan demo 212 . bingung duit mau di tabung atau investasi $MENTION$ $URL$,demo 212,positive
"yg kya begini msti dikurang2in nih. yg baik dari demo 212 diambil, yg ga baik jangan. $URL$",demo 212,neutral
anda yg banga dengan demo 212 ? dan anda yg netral? anda yg mencibir? sudahlah. marilah kita bangun bersama negri ini dgn hal +,demo 212,neutral
trnyata ada intimidasi pd jurnalis sat demo 212 kmrin .,demo 212,neutral
krn gw ngerti gw berisik. jd menurut lo aktifitas demo 212 41 dengan rukun haji itu sama? ini penistan agama coy! c $MENTION$ $URL$,demo 212,neutral
"$MENTION$ ngitung demo 212 macam gak ad krja aja gak ad manfatnya, mending joging banyak manfatnya.",demo 212,negative
khotbah sholat jumat habib rizieq bikin gempar indonesia demo 212 $URL$ lewat $MENTION$,demo 212,neutral
megawati minta sby tidak ikut campur demo 212 klo sby ikut campur megawati tak bisa main bola didalam $URL$ lewat @,demo 212,neutral
"ini kira2 pengandaia tepat ngak si? yahudi, cina, sama demo 212 . kok kemana2 kyknya.",demo 212,neutral
"astafirulah ! minuman peserta aksi demo 212 diracuni, keterlaluan ! $URL$ lewat $MENTION$",demo 212,neutral
"76milyar biaya pengamanan demo 212 & 41, itu baru pengamanan yah $URL$",demo 212,neutral
ntn $MENTION$ ada bripda $MENTION$ aksi demo 212 qyo serbu net guys $MENTION$,demo 212,neutral
"dijelaskan kapolri, ternyata begini skenario makar yang bakal tungangi demo 212 kemarin $URL$",demo 212,neutral
"haha demo 41 kata 3,2 juta, demo 212 dua kali lipat demo 41. arti 3,2 x 2 = 6,4. kok bisa jadi 7,5 juta. ngitung saja salah bib $URL$",demo 212,neutral
politik demo 212 $URL$,demo 212,neutral
ternyata demo 212 kemarin itu benar adanya. 212 $URL$,demo 212,neutral
"usai demo 212 jakarta ,kaesang ungah foto payung jokowi , habib rizieq : dasar tukang pamer !: $URL$ via $MENTION$",demo 212,neutral
"waduh, klo yg demo 212 semua langsung ditindak terus aksi kebhinekan mana ada tindakan ? betul2 ketidak adilan",demo 212,positive
7 jt org itu 70% warga dki setara dg peserta demo 212 tp kl dipikir2. asudahlah mrk jg ga bakal mikir.,demo 212,neutral
"sepanjang jalan kepikiran demo 212 . unjuk rasa (yang katanya) 7juta orang, pemegang keputusan tetep satu org => hakim. berasa",demo 212,neutral
"ngakak ! gara ikut demo 212 untuk ahok, master limbad akhir buk. $URL$ lewat $MENTION$",demo 212,neutral
[dpr terkini] ketua dpr setya novanto puji demo 212 damai $URL$,demo 212,positive
"akibat aksi demo 212 , pedagang merugi rp60 miliar via $MENTION$ $URL$",demo 212,negative
"1,160 views rekaman percakapan dgn salim abdul qadir sebut agus di demo 212 beredar, . from $MENTION$ $URL$",demo 212,neutral
provokator demo 212 tewas di tahanan polisi? $URL$ $URL$,demo 212,neutral
lengkap da orang fitnah di team sana. terbukti demo 212 atas pesanan,demo 212,negative
kasus penghinan presiden oleh ahmad dhani akan mulai diproses usai demo 212 . $URL$,demo 212,neutral
"merinding! kawal demo 212 , polisi kembali kerahkan pasukan asmaul husna berita terbaru: $URL$ via $MENTION$",demo 212,neutral
"raker ke dpr, kapolri diminta jelaskan soal penangkapan aktivis sat demo 212 $URL$ $MENTION$ $URL$",demo 212,neutral
"dita motivasi ikut naik pangung di demo 212 , begini jawaban kapolri $URL$",demo 212,neutral
walah.kapolri klaim yang kendalikan masa demo 212 hinga berlangsung damai $URL$ $URL$,demo 212,neutral
"dita motivasi ikut naik pangung di demo 212 , begini jawaban kapolri > $URL$",demo 212,neutral
walah.kapolri klaim yang kendalikan masa demo 212 hinga berlangsung damai > $URL$,demo 212,neutral
"kurang lebih 1 juta demo 212 itu, eh, aksi damai.",demo 212,neutral
lek delok uwong nde fesbuk sing mendukung dan memuja demo 212 kemaren. not sure if sarcasm or he actualy mean it,demo 212,positive
kapolri klaim berhasil kendalikan masa demo 212 hinga berlangsung damai > $URL$,demo 212,neutral
kapolri klaim berhasil kendalikan masa demo 212 hinga berlangsung damai $URL$,demo 212,neutral
alasan polri tangkap 1 tersangka makar jelang demo 212 $URL$,demo 212,neutral
*$MENTION$ pda jendral yg pki peci putih pak demo 212 cinta damai.,demo 212,positive
"ternyata tidak semua buruh dukung demo 212 - jakarta - federasi serikat buruh niaga, keuangan dan perbankan. $MENTION$ $MENTION$ $MENTION$",demo 212,neutral
"hits rekaman percakapan dgn salim abdul qadir sebut agus di demo 212 beredar, siapakah habib ja'far kudus? $URL$",demo 212,neutral
"pak, saya tguin bukti demo 212 dbayar kok gk dkirim. kt 212 dbayar? nemu gk pak? saya malah nemu ini malah. $URL$",demo 212,neutral
panglima tepis isu percoban pembunuhan presiden sat demo 212 $URL$,demo 212,neutral
panglima tepis isu percoban pembunuhan presiden sat demo 212 | $URL$,demo 212,neutral
$MENTION$ demo 212 bukan ber zikir.? $URL$,demo 212,neutral
penjelasan singkat ustad farid akmad okbah terkait demo 212 dan perbedan ijtihad ulama $URL$,demo 212,neutral
terlepas dari apresiasi sy pada demo 212 yg layak diacungi jempol dan keteguhan para peserta - spark the fire $URL$,demo 212,positive
"subhanaloh ! dari depan ka'bah di mekah, wni dukung aksi demo 212 $URL$ lewat $MENTION$",demo 212,neutral
oh gitu yah kalo yg ikut demo 212 pelintir aksi tolak ahok jadi bela agama. yg kayak gini disebut penjilat agama.,demo 212,neutral
keren ! aksi a gym sat pungutin sampah usai demo 212 $URL$ lewat $MENTION$,demo 212,neutral
ijin share pak dokter genis ginanjar masih banyak yg nyinyir soal demo 212 yg kata bayaran kmrn padahal gak. $URL$,demo 212,negative
hasil rapat kapolri & komisi i dpr - aksi makar demo 212 | berita terbaru 05-12-2016: $URL$ via $MENTION$,demo 212,neutral
$MENTION$ aksi demo 212 dan kondisi umat islam akhir zaman penuh fitnah $URL$ via $MENTION$,demo 212,negative
evaluasi gnpf mui usai demo 212 ! k h misbahul anam sat habib rizieq. $URL$ lewat $MENTION$,demo 212,neutral
kapolda jawa tengah ancam pidanakan pemberi fasilitas demo 212 - warta kota $URL$,demo 212,negative
metro tv dibuly peserta demo 212 ! ini kalau membuat berita bodong $URL$ lewat $MENTION$,demo 212,negative
"orasi kapolri di demo 212 : ditangan kpk ahok bisa bebas, tapi di tangan polisi ahok jadi tersangka: $URL$ via",demo 212,neutral
"heboh ! panitia demo 212 "" konsumsi seharus sudah habis tapi tidak ha. $URL$ lewat $MENTION$",demo 212,neutral
"td br interview terapis refleksi.dia crt temen yg nama asep hr jumat kmrn ikut demo 212 .dibyr 30rban dpt baju, peci,nasi",demo 212,neutral
"makna demo 212 menurut djarot - no 2 - 1 putaran - 2 periode , pasti setuju dan share ! $URL$",demo 212,neutral
$MENTION$ dpkab16868519016 mhn dpt dikirimkan kembali - asap - stlh kendala demo 212 . tks.,demo 212,neutral
agus p. sakti - negative efect in demo 212 read on $URL$,demo 212,negative
i liked a $MENTION$ video from $MENTION$ $URL$ rapat kapolri & komisi i dpr - aksi makar demo 212,demo 212,neutral
limbat ikut demo 212 penasaran mau tau suara ?: $URL$ melalui $MENTION$,demo 212,neutral
"kemarin kalau yg demo 212 udah dibuly sama media fansxbudiman wkwk ingat banget pas 41,media mereka blowup",demo 212,neutral
$MENTION$ $MENTION$ sayang gk di dukung yg demo 212 kmrn ya,demo 212,positive
ngajak diskusi tentang demo 212 . pake ngancam presensi. inti begitulah kutak tau,demo 212,neutral
"sekarang tambah 1 ukuran lagi, ikut demo 212 $URL$",demo 212,neutral
kapolri buka rahasia mengapa demo 212 berlokasi di monas $URL$,demo 212,neutral
setelah demo 212 dan 412 masing2 suporter memperkirakan berapa jumlah yang demo kemarem $MENTION$,demo 212,neutral
kmrn berita msk tvri kt menyisakan sampah berserakan dan dibandingkan sm demo 212 yg bersih dr sampah. tvri loh $URL$,demo 212,positive
"jadi sekarang ada ukuran orang itu beriman atau tidak,yaitu ikut demo 212 atau tidak. lalu wakil tuhan memberi ijasah lwt twiter.sombong",demo 212,positive
"ah elah masih ributin cumi2 jumlah demo 212 , emang 70 ribu lebih gitu dikit yah? emang kalian sangup kerahin masa segitu banyak?",demo 212,neutral
"pasca demo 212 dan menjelang natal, surabaya masih konsisten kalau agama bola.",demo 212,neutral
"$MENTION$ gapapa habib. kompas harus pinter, demo 212 hasilkan banyak rezeki. 1 kg sampah? ini berton ton harus banyakz",demo 212,positive
"itu mah terlalu jauh. nih yg lokal, jg bikin gagal fokus., mungkin kelelahab setelah ikut demo 212 . $URL$",demo 212,neutral
"klo kita telah demo 212 bukan u/ ahok, ahok terlalu kecil u/ itu, ini memperlihatkan ke negara lain, bahwa islam itu santun, indah & damai $URL$",demo 212,neutral
i liked a $MENTION$ video $URL$ khotbah sholat jumat habib rizieq bikin gempar indonesia demo 212,demo 212,neutral
ketua dpr setya novanto puji demo 212 damai $URL$ $URL$,demo 212,positive
aman demo 212 bukan karena polri dn tni tp karena ulama,demo 212,positive
"menurut hitungan saya demo 212 dikuti 12.213.542 orang, kalau yg parade 412 dikuti 51.372 orang kalau tdk percaya hitung ulang sendiri saja",demo 212,neutral
evaluasi gnpf mui usai demo 212 ! k.h misbahul anam: sat habib rizieq jadi presiden ri! $MENTION$ . $URL$,demo 212,neutral
"7,5 juta orang yg demo 212 kemarin? meragukan sekali *sudahkuduga*",demo 212,negative
provokator demo 212 meningal di tahanan? polisi: itu berita hoax $URL$ $URL$,demo 212,neutral
"yg demo 212 kemarin kan banyakan dari luar jakarta, percuma lah mau claim masa jutan",demo 212,neutral
"di tl msh membahas berapa jumlah org yg ikut demo 212 ?jabilak, selo tenan uripmu ndes",demo 212,neutral
"demi ikut demo 212 , pria asal aceh ini rela jual mobil $URL$",demo 212,neutral
sy setuju demo 212 . tp alangkah baik jg buat demo ks korupsi yg sdh kronis. korupsi sdh mbuat jutan rakyat miskin,demo 212,positive
parade kebudayan ha bagian kecil pendukung ahok yang berlangsung damai melebihi demo 212 yg memakan korban penahanan aktivis negeri ini.,demo 212,negative
"buzer ahok klas internasional dan nasional ber tekuk lutut di di acara demo 212 7,5 jt hadir, damai walau di guyur hujan tp tdk lari",demo 212,neutral
mliht fenomena sat ini & smngt umt islm demo 212 kt buat mosi tdk prcy pd ahok bru jd cagub sdh hina al quran aplgi sdh mnjd dki1 $MENTION$,demo 212,neutral
"demo 41 ada penyusup, demo 212 bersih $MENTION$ $URL$",demo 212,positive
dan banyak warga cimahi yang ikut demo 212 $URL$,demo 212,neutral
pembelan $MENTION$ terkait intimidasi wartawan&reporter demo 212 kemarin $MENTION$ $MENTION$ $URL$,demo 212,neutral
"ini di atas namakan people power of indonesia, nah ini kan ormas dan hal inj pun di tulis tgl aksi demo 212 jelas hal ini sebuah sinyalemen.",demo 212,neutral
parade kebudayan ini beda. tak ada ketakutan. tidak ada ancaman pada jurnalis. coba lihat demo 212 wartawan dipukul diledekin. benar2 teror,demo 212,negative
kh misbahul anam mukjizat dari alah nyata pada demo 212 : $URL$ melalui $MENTION$,demo 212,positive
debat heboh cak nun! balasan penistan agama setelah demo ahok 41 yaitu demo 212 !: $URL$ via $MENTION$,demo 212,neutral
pernyatan kalo wiro sableng hadir pada demo 212 : $URL$ melalui $MENTION$,demo 212,neutral
shalat nang ndalan menangapi demo 212 kh.anwar zahid: $URL$ via $MENTION$,demo 212,neutral
$MENTION$ maf kalo itu bukan sehari sebelum demo 212 .tapi itu sudah keluar 1bulan yg lalu kok hehe,demo 212,neutral
"1. sat demo 212 , banyak yg menyarankan agar presiden shalat jum'at di masjid istiqlal; 2. presiden dapat info. $URL$",demo 212,neutral
"yg makar pihak sebelah penumpang gelap sis, bukan yg demo 212 .",demo 212,positive
"efek ikut demo 212 , handphone kebasahan alhasil gak foto baju kokoh dari basah sampe kering meriang sampe sekarang $MENTION$",demo 212,negative
keanehan sambutan ceramah jokowi di deman jutan masa demo 212 $URL$,demo 212,neutral
belum ada yg klarifikasi soal jama'ah adzikra arifin ilham yg hadir di demo 212 sebanyak 6 jt orang $URL$ $MENTION$ $URL$,demo 212,neutral
namun sedih juga klo ada orang islam tp menghina mengolok-olok demo 212 kyk bang iwan fals,demo 212,neutral
"berita hoax, pria mabuk acungkan golok ke peserta demo 212 tewas $URL$ $URL$ $MENTION$",demo 212,neutral
aman dan damai dalam demo 212 ya $MENTION$ $MENTION$,demo 212,neutral
"kata aksi demo 212 ditungangin politik, terus 412 yang nungangin siapa.? pantesan sieneng ogah ikutan demo .?",demo 212,negative
inikah skenario demo 212 yang dituding makar? $URL$ $URL$,demo 212,neutral
inikah skenario demo 212 yang ditudingmakar? $URL$,demo 212,neutral
"provokator demo 212 tewas di tahanan polisi, hoax! $URL$ $URL$",demo 212,neutral
"ngapain coba bikin acara tandingan demo 212 , are you people retarded?",demo 212,neutral
ini perhitungan jumlah peserta demo 212 . $URL$,demo 212,neutral
peserta demo 212 cuma 50 ribu orang : predicting how ma people were in 212 prayer raly $URL$,demo 212,neutral
$MENTION$ mas kalo bisa adem ayem aja .krn seolah spt tandingan demo 212 .alangkah bijak kalo kita fokus utk kmenangan ahok,demo 212,neutral
$MENTION$ saudara gubsu $MENTION$ $MENTION$ $MENTION$ melihat 412 ini. $MENTION$ demo 212 di medan. tak layak jadi gubernur $URL$,demo 212,neutral
$MENTION$ demo 212 itu sdh gagal total.1.pangung sdh direbut jokowi 2.tujuan penjarakan ahok tdk berhasil. hb rzq gigit jari.,demo 212,negative
tangapan kh anwar zahid tentang jumatan dijalan sat demo 212 : $URL$ via $MENTION$,demo 212,neutral
"bsa jd yg demo 212 lbh nasionalis dr $MENTION$ , nasionalisme apa yg diusung $MENTION$ shinga mngecilkan nilai kjujuran.?",demo 212,neutral
"jika dihati ente emang cinta nkri, gak perlu ngebacot dan banding2in demo 212 vs 412, kedua demo itu mrpkan wjd cinta tanah air",demo 212,neutral
(kira2&mw tanya) yg demo 212 apa pd paham pancasila ya? kok gak ada yg triak2 hidup pancasila! ?,demo 212,neutral
polres bogor akan cegah masa ke jakarta untuk demo 212 : bogor - jajaran kepolisian yang $URL$,demo 212,neutral
"ini kesan kenapa jelek yh , demo 212 ? pdhal kn kita mau ngebela agama kita.!",demo 212,positive
"jadi demo 212 itu demo utk mendoakan timnas psi, 312 itu pertandingan timnas psi, 412 itu pesta kemenangan",demo 212,neutral
provokator demo 212 meningal di tahanan? polda metro: hoax itu! $URL$,demo 212,neutral
asadiqulhaq: $MENTION$ alasan polri tangkap 1 tersangka makar jelang demo 212 $URL$ $MENTION$,demo 212,neutral
[bp] alasan polri tangkap 1 tersangka makar jelang demo 212 $URL$,demo 212,neutral
$MENTION$ alasan polri tangkap 1 tersangka makar jelang demo 212 $URL$ $MENTION$,demo 212,neutral
retweted mahfud md ( $MENTION$ ): ada yg bilang gini loh. jika dikumpulkan ktp yg datang demo 212 paling2. $URL$,demo 212,neutral
"itu metro tv sudah diusir2 dari demo 212 , ada disiarin gak sih pengusiranya?",demo 212,neutral
dan saya pengagum demo 212 $URL$,demo 212,positive
habib dk seolah tengelam gaungnya. demo 212 menjadi hari presiden $MENTION$,demo 212,neutral
aksi demo 212 sangat berbeda dengan aksi 412,demo 212,neutral
"apa hubungan demo kawin sama demo 212 kemarin. untuk demo kawin itu hal yg pribadi, jadi gak perlu dibahas. bahas yg umum",demo 212,neutral
mungkin metro tivu kesal krn waktu demo 212 kemarin diusir. $URL$,demo 212,neutral
situasi di demo 212 ada badai. $URL$,demo 212,neutral
"seorang penulis (ngakunya) ngasih komen di berita kapolda lampung yg gak setuju demo 212 : "" kirim begal aja ini orang. "" nice.",demo 212,neutral
"yang ikutan demo 212 pada nyinyirin demo 412, sebalik yang ikutan demo 412 pada nyinyirin demo 212 . layf!",demo 212,neutral
"yang ikutan demo 212 pada nyinyirin demo 412, sebalik yang ikutan demo 412 pada nyinyirin demo 212 . layf!",demo 212,neutral
"jangan salahkan debat kusir, demo 212 412 atau 69. biarkan manusia indonesia berjalan menemukan titik terang. inilah awal kejayan indonesia",demo 212,neutral
jgn terkecoh dgn ava si moncong pistol (laras) $MENTION$ dia kecewa dgn demo 212 yg realisasi $MENTION$,demo 212,neutral
"kasian demo 212 , jauh2 beli tiket pesawat, shalat jumat bareng di monas, abis itu disuruh pulang tapi begitulah nama pangilan iman",demo 212,neutral
"hmi untuk nkri serukan wujudkan aksi super damai, tolak penumpang gelap di demo 212",demo 212,neutral
"lah menurut om didu, bhineka yg bener gimana.yang kayak demo 212 .? $URL$",demo 212,neutral
"mesti belajar dari demo 212 kemarin, taman dijaga, sampah dikumpulin.",demo 212,positive
di tl pesbuk ku lg banding2in sampah demo 212 sama 412 . pft,demo 212,neutral
scene (tampak atas) keramaian manusia pd demo 212 dan demo 412 gak bikin hati gw bergetar tuh. biasa aja.,demo 212,neutral
"islam yg masih membela "" dia "" nih. masih menjelekan yg demo 212 . diundang bro. punten merapat gih. $URL$",demo 212,neutral
"insyinyur2x di jerman lagi heboh dengan futuristik mobil dan sejenisnya,insinyur di indonesia msh aja sibuk posing di fb masalah demo 212",demo 212,negative
"agus biarkan demo 212 bawa bendera palestina, dulu fpi malah bawa bendera isis, lebih parah ! $URL$",demo 212,neutral
"yang jadi masalah, kenapa tokoh 412 ikut-ikutan demo dengan tameng kebangsan, apalagi jarak sangat sempit dengan demo 212 ? $URL$",demo 212,neutral
bagiku demo 212 adalah demo ahok $MENTION$,demo 212,neutral
bener juga sich kata temen banyakan demo 212 dibandingin $MENTION$ cuman kalo $MENTION$ smua murni warga dki $URL$,demo 212,neutral
"$MENTION$ demo 212 jelas teriakan menyeramkan, gantung ahok, bunuh ahok, tangkap ahok. 412 asli damai.",demo 212,negative
energi aksi 212 bantu bangkitkan ekonomi syariah- $URL$,aksi 212,positive
7 fenomena kebangkitan islam di aksi 212 $MENTION$ - $URL$ | bicara fakta dalam berita $URL$,aksi 212,neutral
"saingi aksi 212 dan 412, lamongan pu gerakan 1821 yang . - surya $URL$ $MENTION$",aksi 212,neutral
rakyat tau mana media darling penguasa mana yg netral.kejadian pengusiran media pada aksi 212 &berbuntut boikot bukti rakyat sudah cerdas. $URL$,aksi 212,neutral
banyak yg katakan hati bergetar mendengar aksi 212 tp hati ini lebih bergetar mdengar pembelan yg dbaca ahok!,aksi 212,positive
"pasang foto aksi 212 di whatsap, ketua kpu dki: saya netral di pilgub $URL$",aksi 212,neutral
"ayah vidi aldiano, salah satu sosok di balik sukses aksi 212 $URL$",aksi 212,positive
ada banser dibalik damai aksi 212 $URL$ $URL$,aksi 212,positive
"hapus klarifikasi di situs resmi mengenai aksi 212 , website sari roti dalam perawatan $URL$",aksi 212,neutral
aksi 4l bagaikan towaf. aksi 212 bagai orang wukuf .dan setelah wukuf.sat lempar jumroh.,aksi 212,neutral
"jenderal brunei: subhanalah, peserta aksi 212 sama dengan jumlah $URL$ h.com/59ynd meca, makah, mekah",aksi 212,neutral
"yang ikut aksi 212 , anda berani melawan tuhan? $URL$",aksi 212,negative
"30menitsetelah aksi 212 ,keajaiban ini tak pernah dirmuat media $URL$ lewat $MENTION$",aksi 212,neutral
"jenderal brunei: subhanalah, peserta aksi 212 sama dengan jumlah rakyat brunei $URL$ h.com/lpe2o",aksi 212,neutral
ot lautan manusia ini bukan aksi 212 atau apa.ini adalah foto sat mereka yang berjuang mendapatkan tiket. $URL$,aksi 212,neutral
sama sekali ga heran kalo bapak btp dihakimi masa. lha wong saya dicap pendukung bpk btp krn ga ikut aksi 212 kmrn.,aksi 212,neutral
"bukan di situnya, tp pengklaiman dgn mengupload di sosmed beserta caption "" penjual sari roti mendukung aksi 212 "" itu tidak etis",aksi 212,neutral
"saya ha menyaksikan aksi 212 lewat tv sambil nangis, air mataku masih jauh lebih berarti dibanding $MENTION$ si ahok si sombong",aksi 212,neutral
merinding ! cerita aneh dan kisah dahsyat dari ulama ciamis dibalik aksi jalan kaki untuk aksi 212 yang tak. $URL$,aksi 212,neutral
tausiah a gym yg menyejukan hati di aksi 212 bela islam jilid i. $URL$ 0suti,aksi 212,neutral
$MENTION$ from $MENTION$ - kisah nyata peserta aksi 212 . . . seorang teman baru saja resi $URL$ $URL$,aksi 212,neutral
ini komentar pendeta albertus paty mengenai aksi 212 $URL$ via $MENTION$,aksi 212,neutral
statemen kpbi ini adalah pembelan terselubung pada aksi 212 . papua yg harus dibela dr tuduhan makar malah gak disebut.,aksi 212,negative
kemana muara aksi 212 dan 1212? $URL$,aksi 212,neutral
curahan hati dokter peserta aksi 212 $URL$ $URL$,aksi 212,neutral
"*kata mulut sih "" nkri harga mati, tapi duit disimpan di luar negeri "" * aksi 212 dan reaktualisasi nasionalisme. $URL$",aksi 212,neutral
pra aksi 212 gue nangis waktu dpt kabar saudara2 dr daerah dilarang dihalangi spy tdk dtg ke jakarta. gue nangis tp bkn $MENTION$,aksi 212,neutral
besok aksi bela timnas sekalian sholat berjamah biar stadion penuh kayak aksi 212 dan gak jadi maen itu timnasnya.,aksi 212,neutral
$MENTION$ bkn ahoker | aksi 212 bikin merinding | $URL$ $MENTION$ $MENTION$,aksi 212,neutral
"iya, setuju bgt. miris adalah jika ikutan aksi 212 karena benci dengan orang yg ga tau al-quran dan dia dinilai. $URL$",aksi 212,positive
"polisi mematahkan rencana segelintir orang menungangi aksi 212 . kudeta serius atau asal-asalan? $MENTION$ terbaru: "" makar "" $URL$",aksi 212,negative
"klaim di taiwan masa segitu banyak 250rb org, bs bandingkan gak dgn aksi 212 kemaren wak? $MENTION$ $URL$",aksi 212,neutral
