text,target,label
"bicara di iran, fadli zon : muslim harus bersatu redakan konflik islam $URL$",fadli zon,neutral
kampret situ disini kelakuan memecah umat $URL$ wakil ketua dpr fadli zon berharap muslim di dunia bersatu. hal itu diyakini fadli bisa menjadi cara ampuh untuk meredakan konflik di negara islam.,fadli zon,negative
"bicara di iran, fadli zon : muslim harus bersatu redakan konflik islam dpr_ri bksapdpri gerindra $MENTION$ $URL$",fadli zon,neutral
"bicara di iran, fadli zon : muslim harus bersatu redakan konflik islam $MENTION$ $MENTION$ $MENTION$ $MENTION$ $URL$",fadli zon,neutral
"bicara di iran, fadli zon : muslim harus bersatu redakan konflik islam $URL$",fadli zon,neutral
"bicara di iran, fadli zon : muslim harus bersatu redakan konflik islam $URL$",fadli zon,neutral
zon apa ini? fadli zon ?wkwk,fadli zon,neutral
empat keanehan di balik impor beras menurut fadli zon $URL$,fadli zon,neutral
"putusan mk soal presidential threshold, fadli zon : kemunduran $URL$",fadli zon,neutral
"pelaksana tugas ketua dpr ri fadli zon menilai alasan ditolak uji materi presidential threshold oleh mahkamah konstitusi (mk), menegaskan seolah hakim konstitusi ahli berpolitik. $URL$",fadli zon,neutral
"menurut pendapat saya apabila kezaliman terjadi pada suatu daerah apalagi muslim banyak maka alah swt akan menciptakan utusan utk menghancurkan kezaliman itu,maka hadirlah pk fahri,hrs,uas, fadli zon ,pk gatot,pk prabowo dl.ingat alah swt tidak tidur.terbukti",fadli zon,positive
rt jpncom: empat keanehan di balik impor beras menurut fadli zon $MENTION$ $URL$,fadli zon,neutral
pak fadli zon .tolong bantu lah rakyat bapak ini.hangan bicara politik.tapi tolong nyatakan dengan kejadian kami ini.sut 275 kv sijunjung udah bisa di operasikan.tapi hak upah borongan kami kok belum di bayar.mohon pak jangan banyak bicara aja pak.bukti mana pak,fadli zon,negative
$MENTION$ paling yg datang pak fadli zon $URL$,fadli zon,neutral
"delegasi dpr ri dipimpin plt ketua dpr ri fadli zon melakukan pertemuan dengan parlemen iran yang dipimpin oleh ketua parlemen iran ali larijani membahas persoalan palestina, rohingya, serta kerja sama kedua negara, sabtu, 13 januari 2018. $MENTION$ $MENTION$ $URL$",fadli zon,neutral
klo aku lebih respect fadli zon yg jd ketua dpr krn dia sangat tegas dan cinta nkri bukti dia brani ketuk palu bubarkan hti.,fadli zon,positive
empat keanehan impor beras versi fadli zon $URL$,fadli zon,neutral
datangkan fadli zon aja pak ! sy itu seneng bualan bang fadli yg tak menjurus dan banyak mengkritik walau pun dia blm tentu bisa,fadli zon,negative
"fadli zon sebut 4 keanehan rencana impor beras, kementerian pertanian tegaskan tidak untuk umum $URL$",fadli zon,neutral
"rencana pemerintah mengimpor beras sebanyak 50 ribu ton pada akhir bulan ini membuktikan ada kekacauan dalam tata kelola pangan di indonesia. "" sekaligus menunjukan rendah mutu data pangan yang selama ini mereka miliki, "" kata wakil ketua umum partai gerindra fadli zon di. $URL$",fadli zon,neutral
"saya menambahkan video ke playlist $MENTION$ $URL$ 2 tahun jokowi-jk, fadli zon kasih hadiah sajak "" raisopopo "" .",fadli zon,neutral
"people power di filipina, $ilideritad di polandia, dan reformasi wujud parlemen jalanan yg menjatuhkan rezim totaliter menuju demokrasi, apa pemerintahan demokrasi bisa diturunkan parlemen jalanan, ini impian fadli zon dan fahri hamzah yg sering tampil dijalankan dgn fpi",fadli zon,neutral
yg ga beres fadli zon dipercaya.,fadli zon,negative
"di ibu kota ada anis, di dpr ad fadli zon , di luar ad amin ra'is dn sekutu nya, di papua ad nowela, hik.hik.",fadli zon,negative
""" saya legowo dan akan mendukung sepenuh partai hanura dipimpin orang berkualitas bermoral dan memiliki kemampuan manajerial handal "" ( wiranto ) $URL$ $MENTION$ $MENTION$ $MENTION$ $MENTION$ $MENTION$ $MENTION$",wiranto,positive
""" saya sangat sadar bahwa eksistensi partai sangat ditentukan kekuatan ril pemilik partai yakni seluruh angota dan simpatisanya. "" ( wiranto ) $URL$ $MENTION$ $MENTION$ $MENTION$ $MENTION$ $MENTION$ $MENTION$",wiranto,neutral
$MENTION$ - ini pesan wiranto di munaslub hanura,wiranto,neutral
$MENTION$ ini pesan wiranto di munaslub hanura wiranto juga mengungkapkan keinginan yan $URL$,wiranto,neutral
$MENTION$ ini pesan wiranto di munaslub hanura wiranto juga mengungkapkan keinginan yan $URL$,wiranto,neutral
"$MENTION$ melalui pesan singkat, wiranto dukung munaslub kubu suding $URL$",wiranto,neutral
"$MENTION$ "" (munaslub) ini santun dan jangan gontok-gontokan. ini jalan yang benar. pak oso dan pak wiranto bilang boleh asal konstitusional, ya ini sesuai konstitusional, "" ujar chairudin $URL$",wiranto,positive
"$MENTION$ 'selamat berjuang semoga tuhan merestui perjuangan partai hanura. tertanda, wiranto .' $URL$",wiranto,positive
ada baik pak wiranto jadi ketum lagi atau dukung daryatmo,wiranto,positive
"angota dewan pembina hanura, jenderal pol (purn) chaerudin ismail menyingung ucapan oso soal kemungkinan wiranto menjadi ketum kembali. apa katanya? $URL$",wiranto,neutral
"bacakan surat dari wiranto , daryatmo klaim penunjukan sebagai ketua umum hanura sah - $URL$",wiranto,positive
"bacakan surat dari wiranto , daryatmo klaim penunjukan sebagai ketua umum hanura sah $URL$",wiranto,positive
"bagi kader jelas pak wiranto sosok panutan, yang setiap wejangan menjadi penyemangat perjuangan politik hanura. apalagi dalam kondisi seperti sekarang ini. $URL$ $MENTION$ $MENTION$ $MENTION$ $MENTION$ $MENTION$ $MENTION$",wiranto,positive
"bu.! sama2 pendukung $MENTION$ beliau tidak mau arogan. menteri erlanga sudah dlm kabinet lalu terpilih jd ketum, berbeda dng pak wiranto masuk kabinet dng 1 pilihan begitu juga pak muhaimin diberi 1 pilihan. dan pilihan mereka berbeda. sementara erlanga jg berbeda, yakan.? $URL$",wiranto,negative
"bukan wiranto , ini sosok ketua umum hanura hasil munaslub $URL$",wiranto,neutral
"cuma pak wiranto yg bs kembalikan citra partai spt sebelumnya, beliau memang panutan",wiranto,positive
daryatmo jadi ketum lewat munaslub yang direstui wiranto $URL$ $URL$,wiranto,neutral
"daryatmo jadi ketum, hanura 'ambhara' sambangi kediaman wiranto $URL$ $URL$",wiranto,neutral
"daryatmo jadi ketum, hanura 'ambhara' sambangi kediaman wiranto $URL$",wiranto,neutral
"daryatmo jadi ketum, hanura 'ambhara' sambangi kediaman wiranto $URL$ $URL$",wiranto,neutral
"daryatmo jadi ketum, hanura 'ambhara' sambangi kediaman wiranto $URL$",wiranto,neutral
"daryatmo jadi ketum, hanura &$MENTION$ sambangi kediaman wiranto $URL$ $MENTION$",wiranto,neutral
"diminta pimpin kembali hanura, ini jawaban wiranto untuk para peserta munaslub $MENTION$ $URL$",wiranto,neutral
"disebut mau nyapres, wiranto mengaku tetap pilih menkopolhukam $URL$",wiranto,neutral
dua kubu sama mengklaim didukung wiranto . halaman 1 $URL$,wiranto,positive
dukungan oso untuk wiranto kembali duduki kursi ketua umum hanura $MENTION$ $URL$ $URL$,wiranto,positive
dukungan wiranto untuk kubu suding di munaslub hanura $URL$,wiranto,neutral
dukungan wiranto untuk kubu suding di munaslub hanura $URL$,wiranto,neutral
"fokus bantu presiden, wiranto menolak kembali jadi ketum hanura $URL$ $URL$",wiranto,neutral
foto: kader hanura geruduk rumah wiranto : kader partai hanura versi sarifudin suding $URL$,wiranto,negative
foto: kader hanura geruduk rumah wiranto : kader partai hanura versi sarifudin $URL$ $MENTION$,wiranto,negative
foto: kader hanura geruduk rumah wiranto $URL$,wiranto,negative
"gantikan oesman sapta odang, daryatmo klain penunjukan sah, bacakan surat dari wiranto $URL$ $URL$",wiranto,positive
"gerandong mah gak partainya,gak kadernya,gak simpatisanya,gak pendukung semua tukang hoax dan tukang nyinyirin pemerintah doang bisanya,sama jualan kejenderalan si wowo,padahal wiranto dan moeldoko aje yg pangkat lebih tingi aje gak pernah ngomongin kejenderalan",wiranto,negative
hanura 'ambhara': penunjukan wiranto sebagai ketum konstitusional $URL$,wiranto,neutral
hanura 'ambhara': penunjukan wiranto sebagai ketum konstitusional $URL$,wiranto,neutral
hanura kubu sarifudin suding gelar munaslub ini pesan wiranto $URL$,wiranto,neutral
hanura kubu suding klaim oso akan kembalikan jabatan ketum ke wiranto $URL$,wiranto,neutral
hanura kubu suding klaim oso akan kembalikan jabatan ketum ke wiranto $URL$,wiranto,neutral
"$URL$ terkini usai munaslub, kader hanura kubu suding konvoi ke rumah wiranto $URL$ $URL$ $URL$",wiranto,neutral
$URL$ ini pesan wiranto di munaslub hanura $URL$ $MENTION$ $MENTION$ $URL$,wiranto,neutral
$URL$ - ini pesan wiranto sat munaslub partai hanura $URL$,wiranto,neutral
$URL$ hanura 'ambhara': penunjukan wiranto sebagai ketum konstitusional $URL$ $MENTION$ $URL$,wiranto,neutral
$URL$ ini pesan wiranto di munaslub hanura $URL$ $MENTION$ $URL$,wiranto,neutral
ini isi surat wiranto untuk hanura kubu ambhara $URL$ $URL$,wiranto,neutral
ini isi surat wiranto untuk hanura kubu ambhara $URL$ $URL$,wiranto,neutral
ini isi surat wiranto untuk hanura kubu ambhara $URL$,wiranto,neutral
ini pesan wiranto di munaslub hanura $URL$ $URL$,wiranto,neutral
ini pesan wiranto di munaslub hanura $URL$,wiranto,neutral
ini pesan wiranto di munaslub hanura $URL$,wiranto,neutral
ini pesan wiranto di munaslub hanura kubu suding - $URL$ $URL$,wiranto,neutral
ini pesan wiranto melalui whatsap untuk peserta munaslub di bambu apus $URL$,wiranto,neutral
ini pesan wiranto melalui whatsap untuk peserta munaslub di bambu apus $URL$,wiranto,neutral
"ivid - ketua dewan pembina partai hanura, wiranto , menolak jika harus kembali menjadi ketua umum partai hanura. $URL$",wiranto,neutral
jangan2 wiranto dan hanura lgi maen drama,wiranto,negative
kader hanura sebut zaman wiranto lebih baik $URL$ $MENTION$ $MENTION$,wiranto,positive
"ketua dewan pembina hanura wiranto menegaskan tidak akan ada munaslub, dan untuk langkah berikut akan dilakukan lebih elegan. $MENTION$ $URL$",wiranto,neutral
"ketua dpd hanura jateng: sesuai arahan wiranto , munaslub diperlukan bila ada yang tak puas! $MENTION$ $URL$ $URL$",wiranto,neutral
ketua umum partai hanura oesman sapta odang mengungkapkan bahwa ketua dewan pembina partai hanura wiranto mendukung kepemimpinan terkait kekisruhan dengan sejumlah pengurus partai. $URL$,wiranto,positive
ketum baru hanura: saya mohon bimbingan wiranto $URL$,wiranto,neutral
ketum selanjut wiranto lg,wiranto,neutral
"kisruh hanura, wiranto diminta tegas dan tidak abu-abu: sketsa$MENTION$ jakarta polemik terbelah internal partai hanura dikhawatirkan akan makin runyam dan berkelanjutan. ketua dewan pembina hanura wiranto diminta . $URL$ $URL$",wiranto,negative
"kisruh hanura, wiranto diminta tegas dan tidak abu-abu: sketsa$MENTION$ jakarta polemik terbelah internal partai hanura dikhawatirkan akan makin runyam dan berkelanjutan. ketua dewan pembina hanura wiranto diminta . $URL$ $URL$",wiranto,negative
konflik di tubuh partai hanura makin panas aja nih! yuk simak kelanjutan konflik partai besutan wiranto disini! $MENTION$ $MENTION$ $URL$,wiranto,negative
"konflik partai hanura, wiranto dukung pemecatan oso - $URL$ partai hanura kubu ambhara' yang dimotori sekjen syarifudin suding secara resmi mengukuhkan marsdya. - $URL$ $URL$ oads/2018/01/img_2018018_140620.jpg $URL$",wiranto,negative
"lewat "" whatsap "" , wiranto legawa dan dukung kepemimpinan baru hanura $URL$",wiranto,neutral
"lewat "" whatsap "" , wiranto legawa dan dukung kepemimpinan baru hanura $URL$",wiranto,neutral
"lewat pesan whatsap, wiranto dukung munaslub hanura $URL$",wiranto,neutral
"lewat pesan whatsap, wiranto dukung munaslub hanura $URL$",wiranto,neutral
"makar alah atas wiranto , ngotot bubarkan hti, justru hanura hancur lebur $URL$",wiranto,negative
"melalui wa, wiranto legowo dan dukung penuh partai hanura - $URL$",wiranto,neutral
"munaslub gusur oso, wiranto kirim pesan ke kubu suding cs $URL$",wiranto,neutral
"munaslub gusur oso, wiranto kirim pesan ke kubu suding cs $URL$ $MENTION$",wiranto,neutral
oso klaim dapat dukungan wiranto $URL$,wiranto,neutral
"oso yg sdh dipercaya sama wiranto gak menjalankan tugas sbg ketua dengan baik, banyak yg protes, banyak yg dipecah belah, sama sekali gak peduli sama kemaslahatan kader dan partainya. $MENTION$ $MENTION$ $MENTION$ $MENTION$ $MENTION$ $MENTION$ $URL$",wiranto,negative
"oso yg sdh dipercaya sama wiranto gak menjalankan tugas sbg ketua dengan baik, banyak yg protes, banyak yg dipecah belah, sama sekali gak peduli sama kemaslahatan kader dan partainya. $URL$ $MENTION$ $MENTION$ $MENTION$",wiranto,negative
"oso: kalau wiranto mau jadi ketum lagi, silakan $URL$",wiranto,positive
"pak wiranto hanura selamatkan, syg dbuat dgn cucuran keringat kl dbiarkan bgini. ht n oso tdk cocok d hanura. biarkan oso pergi",wiranto,positive
pesan wiranto membahana di munaslub hanura ambhara: selamat berjuang $URL$,wiranto,neutral
pesan wiranto membahana di munaslub hanura ambhara: selamat berjuang $URL$,wiranto,neutral
pesan wiranto membahana di munaslub hanura ambhara: selamat berjuang $URL$,wiranto,neutral
"resmi, ini ketua umum hanura hasil munaslub, bukan wiranto ! $URL$ $MENTION$",wiranto,neutral
sampai kapanpun oso tak bisa tandingi nama besar jenderal wiranto $MENTION$ $MENTION$ $MENTION$,wiranto,positive
sebenar gambaran pemimpin yang bijak dan sangat cocok untuk memimpin ada pada diri pak wiranto . $MENTION$,wiranto,positive
"selamatkan hanura, dpd nt desak wiranto kembali jadi ketum $URL$ $MENTION$ $MENTION$",wiranto,positive
"tak hadir dalam munaslub kubu 'ambhara', wiranto tetap memberi pesan kepada seluruh peserta munaslub. apa yang disampaikan? $URL$",wiranto,neutral
"tak hadiri munaslub hanura, wiranto kirim pesan ke peserta $URL$",wiranto,neutral
"tak pilih wiranto jadi ketum, hanura 'ambhara': beliau tak berkenan $URL$",wiranto,neutral
"tangapi munaslub kubu bambu apus, ini jawaban wiranto $URL$",wiranto,neutral
"tanpa wiranto , hanura tetap selengarakan munaslub $URL$ $URL$",wiranto,neutral
"terkait kepemimpinan baru hanura, wiranto : saya legowo dan akan mendukung sepenuhnya. . . $URL$ via $MENTION$",wiranto,neutral
"terkait kepemimpinan baru hanura, wiranto : saya legowo dan akan mendukung sepenuhnya. . . $URL$",wiranto,neutral
tidak komit pakde soal rangkap jabatan ini menyingung angota koalisi lain. wiranto harus berhenti jadi ketum hanura karena jadi menteri. cak imin pilih tetap jadi ketum pkb dan tak jadi menteri. pemimpin iti harus adil dan komit pada ucapanya.,wiranto,negative
"video: ketua dewan pembina partai hanura, wiranto himbau kader partai hanura selesaikan konflik partai mengunakan hati nurani $MENTION$ $URL$",wiranto,positive
wah.koq wiranto gitu ya? ngrusak partai sendiri $URL$,wiranto,negative
wiranto . tdk ada munaslub2an. $URL$,wiranto,neutral
"wiranto jamin tak ada munaslub, suding tetap mengelar dan direstui $URL$",wiranto,neutral
wiranto janji tindak tegas pungli citarum - warta ekonomi $URL$,wiranto,neutral
wiranto legowo dan dukung kepemimpinan baru hasil munaslub kubu suding $URL$,wiranto,neutral
wiranto restui kubu penentang oso gelar munaslub $URL$,wiranto,neutral
"wiranto tak ada di rumah, pertemuan hanura kubu 'ambhara' diagendakan malam nanti di lokasi lain. seperti apa persiapanya? $URL$",wiranto,neutral
"wiranto titip pesan di munaslub hanura kubu suding, begini isinya: wiranto titip pesan di munaslub hanura kubu suding, begini isinya. dosy menyampaikan pesan wiranto yang mendukung hanura yang dipimpin orang bermoral dan berkualitas. serta, mendukung $URL$ $URL$",wiranto,neutral
"wiranto titip pesan di munaslub hanura kubu suding, begini isinya: wiranto titip pesan di munaslub hanura kubu suding, begini isinya. dosy menyampaikan pesan wiranto yang mendukung hanura yang dipimpin orang bermoral dan berkualitas. serta, mendukung $URL$ $URL$",wiranto,neutral
yah jangan sampe bubar dong kan si wiranto pengen hti yg bubar semaga bukan partai yg bubar,wiranto,positive
"ustaz akhir zaman ditersangkakan polisi, ini kata fahri hamzah $URL$ $URL$",fahri hamzah,neutral
"nah! keren kan opsi untuk 2019, ada anies baswedan, ada fahri hamzah .ada ahy yang juga ganteng",fahri hamzah,positive
fahri hamzah : kadang negara tampak menyelesaikan masalah tapi sesunguh sedang membuat $URL$,fahri hamzah,neutral
"per hari ini, sudah ada 4 orang yang mereply watsapstoriesku tentang oh fahri. "" ra panas lu? "" "" salah minum obat lo?! "" "" lo sama fahri hamzah ae sono "" "" nyet lo desperate gara ngak ditembak apa gimana dah "" bgst teman-temanku",fahri hamzah,negative
"diserang andi arief di twiter, fahri hamzah : apa salahku, kawan? $URL$",fahri hamzah,neutral
"$MENTION$ saling sahut di twiter, fahri hamzah ke andi arief: apa salahku? - detikcom (siaran pers) $URL$ $MENTION$",fahri hamzah,neutral
"soal "" hoax membangun "" , ini kata fahri hamzah $URL$",fahri hamzah,neutral
"pewaris sifat hamzah bin abdul muthalib,paman rasululah. ortu bg $MENTION$ sudah tepat memberi nama fahri hamzah .",fahri hamzah,neutral
bahkan kalaupun ahok yg salah maka yg benar harus dibela! andaikan suatu sat nanti mungkin prabowo/amien rais/ fahri hamzah /raisya yg benar maka kita bela kebenaran.,fahri hamzah,positive
"saling sahut di twiter, fahri hamzah ke andi arief: apa salahku? $URL$",fahri hamzah,neutral
keberanian fahri hamzah udah terbukti.nah ente hehe,fahri hamzah,positive
memang sudah tidak pu rasa malu fahri hamzah itu.,fahri hamzah,negative
"yang merasakan pa fahri hamzah , tp saran saya buat pa fahri hamzah masih banyak lahan jihad selain di pks, suara pa fahri hamzah ga bakalan ke mana mana kalau nyalon dpd juga",fahri hamzah,positive
"yang merasakan pa fahri hamzah , tp saran saya buat pa fahri hamzah masih banyak lahan jihad selain di pks, suara pa fahri hamzah ga bakalan ke mana mana kalau nyalon dpd juga",fahri hamzah,positive
"yang merasakan pa fahri hamzah , tp saran saya buat pa fahri hamzah masih banyak lahan jihad selain di pks, suara pa fahri hamzah ga bakalan ke mana mana kalau nyalon dpd juga",fahri hamzah,positive
"hits disindir mantan staf sby andi arief di twiter, fahri hamzah : "" apa salahku?apa salahku pada dirimu kawan? kenapa kamu begitu? "" $URL$",fahri hamzah,neutral
"diserang andi arief di twiter, fahri hamzah : apa salahku, kawan? - news $URL$ $URL$",fahri hamzah,neutral
"diserang andi arief di twiter, fahri hamzah : apa salahku, kawan? - news $URL$ $URL$",fahri hamzah,neutral
"diserang andi arief di twiter, fahri hamzah : apa salahku, kawan? $URL$",fahri hamzah,neutral
saya mau mencari siapa koruptor di belakang fahri hamzah $URL$,fahri hamzah,neutral
makin mantap pak fahri hamzah . semoga alah melindungi amin,fahri hamzah,positive
"bamsoet jadi ketua dpr, posisi fahri hamzah terancam? $URL$",fahri hamzah,neutral
"bamsoet jadi ketua dpr, posisi fahri hamzah terancam? $URL$",fahri hamzah,neutral
kadang negara seperti sedang menyelesaikan masalah padahal negara sedang membuat masalah . ( fahri hamzah ),fahri hamzah,neutral
mencari koruptor di balik fahri hamzah $URL$ $URL$,fahri hamzah,neutral
fahri hamzah : kenapa kita takut dengan narasi islam? ini proyek islamophobia $URL$,fahri hamzah,neutral
"bungkam bahkan permisif pd pihak yg menciptakan kegaduhan politik, kepincangan hukum, pemberi beban hidup rakyat dgn harga2 tingi. tp memusuhi pihak yg peduli rakyat dan penegakan hukum spt fahri hamzah dl. lalu kalian masih ingin mengaku orang baik? di mata yg tak waras, iya",fahri hamzah,negative
"bamsoet jadi ketua dpr, posisi fahri hamzah terancam? $URL$",fahri hamzah,neutral
ada yg mendewakan fahri hamzah buat apa sih? loh twet dia aja pernah ngawur. bedakan hukuman bagi penyuap dan penerima suap dlm u tipikor aja salah.,fahri hamzah,neutral
perseteruan fahri hamzah dengan mantan staf kepresidenan period sby $URL$,fahri hamzah,neutral
"kalau ada yg memusuhi atau membenci seorang politisi bersih, lurus, idealis, nasionalis dan vokal spt fahri hamzah , sebenar mereka patut diduga tak pu niat baik untuk bangsa ini.",fahri hamzah,positive
retweted mas piyu ( $MENTION$ ): fahri hamzah : kenapa kita takut dengan narasi islam? ini proyek islamophobia. $URL$,fahri hamzah,neutral
mantan staf sby andi arief dan wakil ketua dpr fahri hamzah saling balas komentar dan sindiran - $URL$,fahri hamzah,neutral
"rt aleluwu: fahrihamzah : "" saya pu dignity (harga diri/martabat), sy gak mau, sy gak bisa dibeli orng, sy bisa ngomong gini krn gak mau dibeli orng! "" andiarief_ : "" saya betul2 mau mencari siapa koruptor di belakang fahri hamzah "" poling! percaya f $URL$",fahri hamzah,positive
"pemerintah impor beras, fahri hamzah : tak perlu jago yang penting serius, saya kasih tahu dimana sembunyi mafia beras $URL$",fahri hamzah,neutral
fahri hamzah : kenapa kita takut dengan narasi islam? ini proyek islamophobia | portal islam $URL$,fahri hamzah,neutral
"ketika fahri hamzah santer disukan akan digeser, muncul anak muda dari fraksi. calon kuat penganti fahri hamzah $URL$",fahri hamzah,negative
"ketika fahri hamzah santer disukan akan digeser, muncul anak muda dari fraksi. calon kuat penganti fahri hamzah $URL$",fahri hamzah,negative
untung bangsa ini ha ada 1 model fahri hamzah kalau ada 10 bisa rusak negara ini $URL$,fahri hamzah,negative
kami juga pemilik fahri hamzah,fahri hamzah,neutral
tangapan fahri hamzah tg penangkapan ustaz akhir zaman $URL$,fahri hamzah,neutral
fahri hamzah : kenapa kita takut dengan narasi islam? ini proyek islamophobia $URL$,fahri hamzah,neutral
"waktu di ilc juga bag fahri hamzah udah jelas menerangkan soal mahar yg memang ada di setiap partai politik di indonesia, dalam sistem politik kita yg sudah hampir berlangsung puluhan tahun, dan itu sangat sulit ,tapi optimistis harus untuk sbuah kebaikan",fahri hamzah,positive
orang yg hebat dan berkuasa mutlak itu cm satu dindonesia ya fahri hamzah,fahri hamzah,positive
"$URL$ 1/141481/setya-novanto-menang-praperadilan-fahri-hamzah-senang setya novanto menang praperadilan, fahri hamzah senang",fahri hamzah,neutral
""" $MENTION$ : pemerintah itu butuh angota dpr kayak pak fahri hamzah , kritis. pemerintahan harus diawasi, dikritisi. .sebagian bsar tersandr",fahri hamzah,positive
ujung kisah century : sebuah catatan dan penelusuran fahri hamzah re-open skandal century bakalan ada yang kejang2 $MENTION$ $MENTION$ $MENTION$ $MENTION$ $MENTION$ $MENTION$ $MENTION$ $URL$,fahri hamzah,neutral
perseteruan fahri hamzah dengan mantan staf kepresidenan era sby: mantan staf kepresidenan susilo. $URL$,fahri hamzah,neutral
perseteruan fahri hamzah dengan mantan staf kepresidenan era sby: mantan staf kepresidenan susilo $URL$ $MENTION$,fahri hamzah,neutral
wakil ketua dpr taufik kurniawan mengatakan pimpinan akan menindaklanjuti permohonan pergantian posisi fahri hamzah yang diajukan partai keadilan sejahtera (pks) setelah ada kekuatan hukum tetap. $URL$ 86498?chanel_id=103&host=$URL$ $URL$,fahri hamzah,neutral
"wah wah banyak juga ya fans om fahri hamzah ,emang tuh orang keren sih,cerdas luar biasa",fahri hamzah,positive
pimpinan dpr tindaklanjuti pergantian fahri hamzah sat kasus inkrah $URL$,fahri hamzah,neutral
pak fadli .masalah kami ini.kami juga mohon bantuan pak fahri hamzah .terimakasih pak,fahri hamzah,positive
terus maksudmu kamu lebih pinter dari fahri hamzah ? hehe jangan mimpi mas udah siang.,fahri hamzah,neutral
"presiden 2019?retwet ntuk jokowi, like ntuk fahri hamzah . $URL$",fahri hamzah,neutral
$MENTION$ : mantan staf sby andi arief dan wakil ketua dpr fahri hamzah saling balas komentar dan sindiran $URL$ berita betulan,fahri hamzah,neutral
mantan staf sby andi arief dan wakil ketua dpr fahri hamzah saling balas komentar dan sindiran $URL$ via $MENTION$,fahri hamzah,neutral
saya melihat ha fahri hamzah yg mewakili ruh pks yg sebenarnya.seharus beliau yg jadi presiden pks.,fahri hamzah,positive
"saling sahut di twiter, fahri hamzah ke andi arief: apa salahku? $URL$",fahri hamzah,neutral
hm. belum ada info $MENTION$ melobi pak bamsoet terkait fahri hamzah . $URL$,fahri hamzah,neutral
"pemerintah itu butuh angota dpr kayak pak fahri hamzah , kritis. pemerintahan harus diawasi, dikritisi. bliau cocok sebagai pengawas, partner berpikir pemerintah. cocok di legislatif & kurang cocok di eksekutif cuma satu hal, serangan beliau terhadap kpk to much.",fahri hamzah,positive
"sy cenderung sepakat dengan fahri hamzah , hulu memang ada pada pembiayan politik. negara memang harus. $URL$",fahri hamzah,positive
aku bantu ya. hidup fahri hamzah $MENTION$ $URL$,fahri hamzah,neutral
agak rancu kata2 si andi arip.koruptor di belakang fahri hamzah ? lah fh bukan aparat. bukan president(bntar lg)bkn jendral yg bisa nglindungin koruptor,fahri hamzah,neutral
mantan staf sby andi arief dan wakil ketua dpr fahri hamzah saling balas komentar dan $URL$,fahri hamzah,neutral
"andi arief tuliskan 5 sindiran untuk fahri hamzah , begini balasan dari wakil ketua dpr tersebut! $URL$",fahri hamzah,neutral
$MENTION$ mantan staf sby andi arief dan wakil ketua dpr fahri hamzah saling balas komenta $URL$,fahri hamzah,neutral
bener pak fahri hamzah . semangat,fahri hamzah,positive
"andi arief tuliskan 5 sindiran untuk fahri hamzah , begini balasan dari wakil ketua dpr tersebut! $URL$",fahri hamzah,neutral
dampak biji buruk di dki adalah : 1. ada yg angap anies cocok jadi capres 2019 2. ada yg angap fahri hamzah cocok jadi capres 2019 3. ada yg angap partai oposisi itu relijius dampak biji buruk adalah kedunguan permanen,fahri hamzah,neutral
semoga pak fahri hamzah kelak jd ri 1 amin,fahri hamzah,positive
indonesia perlu sosok seperti pak fahri hamzah yang menyuarakan logika dan fakta,fahri hamzah,positive
"$MENTION$ : "" saya pu dignity (harga diri/martabat), sy gak mau, sy gak bisa dibeli orng, sy bisa ngomong gini krn gak mau dibeli orng! "" $MENTION$ : "" saya betul2 mau mencari siapa koruptor di belakang fahri hamzah "" poling! percaya fh silakan rt percaya a silakan like $URL$",fahri hamzah,neutral
lebih top kalau gatot-tgb. atau gatot- fahri hamzah .,fahri hamzah,positive
"berita jokowi semeja dengan setya novanto, fahri hamzah , prabowo subianto $URL$",fahri hamzah,neutral
